{
  "schema_version": "1.0",
  "event_id": "test-radar:example-session:2",
  "source": "pauseable-simulator",
  "data_origin": "simulated",
  "sensor_id": "test-radar",
  "session_id": "example-session",
  "seq": 2,
  "occurred_at": "2026-09-08T03:00:00.200Z",
  "time_status": "synced",
  "uptime_ms": 200,
  "measurement_profile": "ld6004-target-raw-v1",
  "sensor_status": "ok",
  "frame_age_ms": 0,
  "target_count": 0,
  "targets_truncated": false,
  "targets": [],
  "replay": null
}
