{
  "schema_version": "1.0",
  "event_id": "test-radar:example-session:3",
  "source": "pauseable-simulator",
  "data_origin": "simulated",
  "sensor_id": "test-radar",
  "session_id": "example-session",
  "seq": 3,
  "occurred_at": "2026-09-08T03:00:00.300Z",
  "time_status": "synced",
  "uptime_ms": 300,
  "measurement_profile": "ld6004-target-raw-v1",
  "sensor_status": "ok",
  "frame_age_ms": 0,
  "target_count": 4,
  "targets_truncated": true,
  "targets": [
    {"id": 1, "x": -1.2, "y": 0.5, "z": 1.3, "doppler": -1},
    {"id": 2, "x": -0.2, "y": 0.6, "z": 1.1, "doppler": 0},
    {"id": 3, "x": 0.4, "y": 0.7, "z": 1.0, "doppler": 1},
    {"id": 4, "x": 1.1, "y": 0.8, "z": 1.2, "doppler": 0}
  ],
  "replay": null
}
